,reviews.text,Aspects
546,"Works okay as a tablet and especially to access Amazon.No good as a general tablet as there are no Google apps available, such as Chrome, gmail, etc.","['work', 'tablet', 'app']"
547,I love this Kindle. I love the fact that you can use an SD card for more storage. Great job,"['fact', 'card', 'storage']"
548,The device is priced just right to give as a gift for an 8 year old,"['device', 'price', 'gift']"
549,We have had a hard time with tablets and our 8 year old who has been down loading apps since she was around 3-4 years of age so far this tablet has survived everything except the constant draining of battery when used by her .,"['tablet', 'year', 'time']"
550,"I believe it depends on how you want to use it. I bought this for my young kids and they are loving it. They can do basic stuff like surf the internet, watch youtube and play some games. The only complaint that I have is that sometimes it does not charge, even if you have have it connected for the whole night. You just have to restart the pad so that it can charge, but that is the only glitch.","['kid', 'stuff', 'surf']"
551,"Works well. I really like the bigger screen (up from the 7""). Easier to read, just as easier to use if not better.","['screen', 'read', 'use']"
552,"This tablet is great for anyone who uses this for the basics.Load times can be a bit slow for browsing the web or streaming videos, but once it's loaded, it plays without buffering as long as you got internet speeds that are good enough. This tablet is a good size and great for pictures, downloaded videos and music. For its price, it makes a pretty good gift for someone wanting their first tablet.","['tablet', 'load', 'video']"
553,"Bought one for the kids to use while we travel, lots of good free games. Installed VLC media player from the app store and filled up the SD drive with movies. Now they are nice and quite for hours on end.Battery life is awesome!","['kid', 'use', 'travel']"
554,Can't beat the value on this. 5 stars even though it has less apps than the play store.,"['value', 'star', 'app']"
555,"I bought my Fire HD8 as an alternative to carrying around my laptop and having to buy many textbooks for college. The fact that I saved well over $150 on one of the 5 books I had to get this semester was a godsend. Most all undergraduate courses I have seen are offered in eBook form for Kindle. If you do not care about having the constant ability of being on the internet without WiFi or other hotspot, it's a great resource. Pros:Price for this was still less than the money saved for my Biology Book.A lot less weight that 5 college textbooks.So far all books I need for college are available as eBooks through Amazon.A single charge can make it through an 8 hour school day.Cons:If you want/need a network connection, you have to use your phone as a hotspot or connect to another WiFi network. Bottom line, I wanted a cheaper alternative to having to lug over $750 in books around. I came out at well under $500 considering I bought this.","['college', 'book', 'network']"
556,My only disappointment is the inability to download some of the apps I use in my phone.,"['inability', 'download', 'app']"
557,I had the previous model which was fine for reading but a little slow for other things. The extra .5 RAM makes a difference. Very happy and if you're a Prime member there are lots of freebies!,"['model', 'fine', 'thing']"
558,"I like this tablet. It has everything you want. However the apps within it need to be updated more often. If this happened than it would be top above an iPad mini. For now, it gives me enough of what I need and in HD. For $89 it was a good deal.","['app', 'need', 'update']"
559,"Great inexpensive tablet for everyday use. It's not powerful enough for super graphical games but it's great for basic apps like surfing the web, emails, news, etc. Amazon has ""underground"" apps which is totally free (including in-app purchases). Only downside with those is that you sometimes see a full screen ads in them (usually products that's on your Amazon wishlist). All-in-all, it's a great tablet that you don't have to worry about if you break it.","['app', 'tablet', 'everyday']"
560,Great price of 89 dollars on a great tablet. It is very fast at everything accept game play. For example it plays asphalt 8 and the game is just barely playable. The graphics struggle on this tablet with higher graphic games. Also it is a Amazon tablet with no Google play store but you can load Google play on to it. There are great you tube videos on how to put Google play on a amazon tablet. The screen is good as long as the sun isn't hitting it. The stereo speakers sound great and loud. All in all I really liked the tablet for the price but I really like to play games with good graphic quality. So that being said I did return this tablet and ordered the Nvidia Shield 8 inch tablet through Best Buy for 199 dollars. I got the Shield a week ago and WOW!! What a difference in graphic gaming quality. This thing is just as good as an Xbox1 or ps4. The Nvidia Shield tablet is simply unbelievable for the price of 199 considering the Apple or Samsung tablets that are as fast as this tablet are at least twice the cost. Plus this dubbles as a gaming console for xbox or pc games with 4k out to you tv. The Amazon tablet is also a great tablet for normal usage but if your a gamer like me the Nvidia tablet is the tablet of choice hands down period!! I don't know why bbuy kind of hides the Nvidia tab only on their website and doesn't sell it in the store. If they displayed it in the store. This would outsell the Apple or Samsung tablets. I hope this helps thanks.,"['tablet', 'game', 'price']"
561,I find this fire much lighter and very easy to use,"['fire', 'use']"
562,"I use this primarily as a reader; however, it has a smaller number of unread books that are not in the familiar ""carousel"" as in other Kindle readers. As a tablet it is faster, brighter and more clear than other tablets that I have used for internet purposes. I would recommend this product to anyone who uses a tablet or a reader.","['reader', 'tablet', 'number']"
563,Does great on browsing and doing research easy to use and love the features especially the private browsing a great price as well,"['research', 'use', 'love']"
564,Great little tablet for a great price. I keep it at work for listening to music or some lunchtime reading.,"['tablet', 'price', 'work']"
565,Wanted to travel without my laptop. Found the Fire to be perfect. Used it mainly for checking email and keeping up with Facebook posts of friends. Found the size of screen to be easy to read. Typing a tad uncomfortable until one has some experience using it. Have yet to use as an ereader.,"['travel', 'laptop', 'use']"
566,great tablet to replace kindle. Love the features.,"['tablet', 'replace', 'kindle']"
567,This is a great tablet for my teen. She loves it and the price can't be beat!,"['tablet', 'teen', 'price']"
568,"This is a great tablet. It has amazing storage. I use mine daily. Great for reading, surfing the web and games. The one small thing I don't like is Amazon prime shows are a bit dark for some reason. Hulu and Netflix work wonderful.","['tablet', 'storage', 'reading']"
569,The kindle is great to read on. I also like that you can play some games.,"['kindle', 'read', 'play']"
570,I love the amazon tablet very much and love to use,"['amazon', 'love', 'use']"
571,its good performance and highly recommended to amazon users,"['performance', 'amazon', 'user']"
572,"I bought this for my wife to replace her 7"" fire that was having a hard time holding a charge anymore. She is thrilled! It was easy for her to transfer all of her books and apps from her old fire to this. She mainly uses this for books , email and some games so this is the perfect tablet for her. better graphics and quicker with the 16gb storage","['fire', 'book', 'wife']"
573,"If you don't want or need something cheaper than an iPad but of quality, this is a great happy medium.The processor makes for a fluid ride with it. It's speedy. The Android Store gives you good app options and the Amazon ecosphere is everywhere here.The software is a touch buggy but it's still a great deal of a tablet.For a child, for something you want to use casually on a dime, it's recommended.","['quality', 'medium', 'processor']"
574,Easy to read. Light in weight. Has many good features.,"['read', 'weight', 'feature']"
575,"I read about this new 8"" Amazon tablet in the New York Times. My Google Nexus 7, 4 years old, was getting slower and slower, and I needed to upgrade - for as little money as possible.This Amazon Fire 8"" is an excellent value for the money(only $89!) - very fast, great screen resolution, and easy to use. I was skeptical of the Silk browser, which I'd never heard of, but it works fine. There is no ""page forward"" arrow, which is odd, only backwards, but I can live with that.It has exceeded my expectations and I'm very happy with it. I'm not in the Amazon ecosystem, this is my first foray, and it's a good one! Congrats to Amazon for making an affordable, great quality tablet!Also, the purchasing experience at Best Buy was easy and convenient, as always!","['tablet', 'year', 'money']"
576,"The new Fire HD 8 is an improvement over the Fire HD 7"". It is faster and the larger screen makes reading books much easier. I do wish the screen was easier to read when outside or in the car. Too much glare in those places.","['screen', 'hd', 'improvement']"
577,Love it! I'm not computer savy but was able to figure out most things without any help.,"['computer', 'figure', 'thing']"
578,Mother needed something since her tablet had died. Was lot easier for her to learn than her old table. She does lots more with Kindle than she did with tablet,"['mother', 'tablet', 'lot']"
579,Light to carry and good picture quality. This was purchased for a hearing impaired person to download video in American Sign Language . This product was easy to maneuver for someone that was not use to a tablet.,"['light', 'picture', 'quality']"
580,I love this tablet. I purchased them for gift and am so glad I did!,"['tablet', 'gift']"
581,"The new Fire HD 8 tablet is a nice upgrade over the previous version. Storage doubled to 16 GB and the RAM increased by 50% to 1.5 GB. This makes the tablet faster and more responsive. With the improved battery life and much lower price, this is a great general purpose tablet.","['tablet', 'version', 'storage']"
582,I purchased it for my dad (70)He needed something easy to use. He really enjoys it.,"['dad', 'use']"
583,"It a great product..,. The quality is awesome the pictures is good and clear...","['product', 'quality', 'picture']"
584,i have had not issues with my purchase. i found a great cover for it on line on amazon and use it every night. thank you for your service.,"['issue', 'purchase', 'cover']"
585,"This has a great picture, good size, lots of storage and a camera. Would recommend","['picture', 'size', 'lot']"
586,I went from the 7 inch Kindle to the 8 and it really made a difference. Easier to read and clearer than my old one.,"['inch', 'difference']"
587,"I love this Tablet. It's easy to use, a great price & lightweight.","['use', 'price', 'lightweight']"
588,"This is my second Kindle Fire HD. I was satisfied with the first one, but now I'm really enjoying the larger screen. My biggest need is to preserve the progress I've made in various games without having to replay them, but at least I have access to all my books, movies and games. Love the Kindle!","['game', 'screen', 'need']"
589,"Love the product. I use it every day for Web,Games and reading.","['love', 'product', 'day']"
590,"I bought this to replace my wife's (1st generation) Kindle Fire. She likes it even better than the old one, especially the pinsharp screen.","['generation', 'screen']"
591,"Great Kindle fire, works great for reading, playing games, etc. Highly recommend to everyone.","['fire', 'reading', 'game']"
592,"Very pleased with this device. Great price, easy to use, and light weight.","['device', 'price', 'use']"
593,Nice upgrade from my old kindle. I like it very much.,['kindle']
594,"For the price this is perfect. I read books, search the web, watch Netflix. It's not an iPad but for the price it is amazing!","['price', 'book', 'search']"
595,İt is cheap tablet option coming from amazon. Latest model will satisfy your needs,"['tablet', 'option', 'amazon']"
596,"Very descent for a non-IPAD. Good speakers. Great price. The screen is a little dark. Great buy if you have Amazon Prime since you can download stuff and watch it offline (great for trips, etc...). Overall great cheap IPAD or even as a back-up tablet. Terrific battery life too.","['descent', '-', 'ipad']"
597,"This thing looks nice, runs nice and feels nice and for the price I don't think you can find a better tablet.","['thing', 'price']"
598,"Got this for my 9 year old after her ipad crashed and burned. She does not like androids at all but I couldn't afford a expensive tablet for her. So we took a chance with this one. She is pleased and I'm pleased it seems so sturdy , not cheap quality at all. Going to get our youngest child one now. Very pleased.","['year', 'ipad', 'crash']"
599,"The quality of display is better than expected for the price. (Keep in mind that this is not an iPad!). Apps from amazon are well integrated and the functionality is fully enjoyable without limitation. Very satisfied with the product. This review is for Fire HD 8, 16 GB.","['quality', 'display', 'price']"
600,I like it but I had a hard time figuring things out.Do I get to talk to geek squad free? Can I come down to the store and get someone to help me with my questions.Will there be a fee for that service?,"['time', 'figure', 'thing']"
601,"Beautiful HD resolution on this tablet. Love the 8"" size, not too big nor too small.","['resolution', 'tablet', 'love']"
602,"This is an awesome tablet, fast, great display and has all the apps I need for personal entertainment If you look for a great tablet for entertainment this is the best you can have, if you want a tablet for working applications this is not the one so be aware and buy this tablet if you want tons of entertainment. also it have a larger processor and internal memory and the external memory to keep all your photos is unbelievable I strongly recommend it, again, not for work but for entertainment.","['tablet', 'entertainment', 'memory']"
603,"I bought 2, 1 for each kid. Easy to set up and figure iut. I went with the staff member's recommendation and I am so glad I did. I love the internet safety organ on it through Amazon. $2.50 a month per kid for unlimited age related and child safe Internet access and movies, books, games and apps and I can set the time it shuts off and a minimum time for them to read each day. Love love love.","['love', 'internet', 'time']"
604,"Good tablet, great price, easy to use, pick up simple","['tablet', 'price', 'use']"
605,Very happy with my kindle. Would buy it for my kids,"['kindle', 'kid']"
606,"I am a power user; there's no other way of putting it. I work in IT and I research the heck out of products before I buy. I had an iPad Mini 2 that was just not up to snuff with iOS 10 so I sold it and bought (and eventually returned) the 2016 Fire HD 8. First let me say it's a great tablet for the price and for probably 50-60% of tablet users who surf the web and watch Netflix. It also helps if you are a heavy Amazon content user. For me, I was spoiled by the retina display on the iPad. The 720p display is alright, but you can see the pixels. 189ppi is pretty low by today's standards. The other big thing for me was the lack of a laminated display. It's glare city on this thing. Display nitpicks aside, it punches above its price point. If you don't play really heavy games (which it even plays Titan Quest surprisingly well!) and you don't mind not having an absolutely beautiful screen I think it runs and works fine. It just wasn't for me. I bit the bullet and went with a 128GB iPad Air 2 as its on special at BB for super cheap right now.","['user', 'display', 'price']"
607,This is not a bad product. Amazon offers greats products but this tablet was missing features even for a basic tablet. The lack of google chrome compatibility made this tablet not right for me.,"['tablet', 'product', 'feature']"
608,"So I got my Fire HD 8 originally for ebooks since e-copies are much cheaper. Very easy to use, especially if you are not tech friendly. So glad I got this.","['e', 'use']"
609,"This was a good tablet. I bought it for my Gf who basically only wanted it for Netflix and YouTube. The display was good, not great. The issue we had was that it kept dropping the wifi connection. This could have been a defect in this one tablet but we returned it and got another one.","['tablet', 'display', 'issue']"
610,"Bought the Kindle for my daughter. It's the 4th we have bought over the years, one for each child. Great product","['daughter', 'buy', 'year']"
611,"GREAT value for the cost - not as fast as a high end tablet, but certainly faster than I was expecting. Clear viewing and easy navigation","['value', 'cost', 'end']"
612,"Husband loves the 8"" tablet. The screen is big enough to view what he is reading","['husband', 'screen', 'view']"
613,For first tablet I am pleased. An amazon name is good value.,"['tablet', 'amazon', 'value']"
614,Excellent price point for my basic requirements. It has all the features I need for comfortable reading of online novels and articles.,"['price', 'point', 'requirement']"
615,This is a good product for the price. Many more things can be done with this fire 8 than we dreamed about.,"['product', 'price', 'thing']"
616,Easy access to my Amazon account. Easy to set up and use.,"['access', 'account', 'use']"
617,"This item has a very nice readout, and is well built as far as I can tell. The overall size is very suitable, and the price was reasonable. I get great service at Best Buy every time I shop there.","['item', 'size', 'price']"
618,Does everything I needed and moreI use it as a travel companion and the size is great.,"['use', 'travel', 'companion']"
619,Its so perfect for my niece & she loves it. Going to get another one for my son.,"['niece', 'son']"
620,the performance is so much faster than my old one and the graphics are much better too.,"['performance', 'graphic']"
621,Love my kindle it does everything I wanted I to do.,"['love', 'kindle']"
622,"I wanted a tablet that was easy to use that I could access my email, internet and stream shows/movies! It's perfect!","['use', 'email', 'internet']"
623,As expected. I am very happy with this. This serves the purpose,['purpose']
624,Handy to use and size is good. It's light weight and that's important.,"['use', 'size', 'weight']"
625,I got this for my husband birthday and he loves it,"['husband', 'birthday', 'love']"
626,This kindle is great. Battery lasts much longer than old kindle.,"['kindle', 'battery']"
627,"Where do I begin...good clarity, I love the size and storage capacity! Very affordable, love watching Netflix on it. I do wish I could have gotten the purple, got the color black, but overall I'm very happy with my purchase.","['clarity', 'size', 'storage']"
628,"I didn't think to much of it at first glad at the store, I decided to purchase it. IT WAS THE BEST DECISION EVER MADE","['store', 'decision']"
629,I bought the Fire HD 8 & CaseI use it mostly for class..works very good..would be better if it had BlueTooth.,['class']
630,We have several kindles and this is the latest version. Its packed with Amazon marketing stuff which is fine if you use them but most just take up space for us. This new version comes with 16gb but allows you to expand the memory with an sd card which is great. One problem if you have a few other kindles is that they are linked to your account so if they are for different family members/kids they may end up with the same stuff on them. My kids mainly use them for game apps and YouTube videos which am seem to work great. The sound is good and the hd video is nice. Overall happy with it and the price was good for this type of tablet.,"['version', 'stuff', 'video']"
631,I went into Best But to buy another reader but ended up buying a Fire 8; good value and has the things I need in a reader.,"['reader', 'end', 'value']"
632,Got the tablet for my grandson he's happy with it and use it as we speak,"['tablet', 'grandson', 'use']"
633,We bought this earlier on line from another vendor and it was never delivered. Best Buy was great.,"['line', 'vendor']"
634,Great buy. Bought it for my 10 year old niece. She loves it.,"['buy', 'year', 'niece']"
635,"I have always gone to buy a kindle because I like the books and th games available. But I found them very unpredictable and unreliable. The color burns futon screen, then the screens starts jumping. As a result I have purchased 8 over the years. Not sure if Want to go through that for the 9th time!","['screen', 'kindle', 'book']"
636,"It's good, saves using up data usage on computer. I use it to keep up to date with the news.","['use', 'datum', 'usage']"
637,"The Kindle Fire HD has a larger screen (8"" vs. 7"") and images are crisper with more vibrant colors.","['screen', 'image', 'crisper']"
638,Just lock the card out and let the kids go crazy!!,"['card', 'kid']"
639,This is an awesome tablet perfectly for watch tv for my little nephew,"['tablet', 'tv', 'nephew']"
640,My kids enjoy reading books and playing games on the fire tablet.,"['kid', 'book', 'playing']"
641,I'm so glad i brought this because it is very handy and easy to use too. Everything about it is good and I really like it.,['use']
642,"At the price it is almost an impulse buy. I wanted a tablet for an upcoming trip to watch some movies, read, etc and this was at a price point that made the decision really easy. If you are used to an iPad, the Fire HD is a little disappointing but it costs considerably less. It fit my needs but I felt some slugginess and several instances of needing to reboot to get certain apps to work correct. If you go in with the understanding this isn't an iPad replacement this should fit the bills for you. Let's just say, after my trip I purchased an iPad Pro and this item will likely be handed off to one of my children. If you have Amazon Prime, you do get some nice perks that make this a really nice item.","['price', 'trip', 'item']"
643,Easy to follow directions allowed her to set it up with me watching over her shoulder.,"['follow', 'direction', 'watch']"
644,I purchased this tablet for my Autistic child. He loves it!!,"['tablet', 'child']"
645,I've enjoyed using my Fire HD8 tablet to play games.,"['tablet', 'play', 'game']"
646,"Beautiful screen, vibrant color, fast and best quality for the money.","['screen', 'color', 'quality']"
647,I use it for downloading and reading books. It is the perfect size for this purpose. It is also very light.,"['download', 'read', 'book']"
648,Bought for wife who is not into the techie word. She likes it - suggest buying a protective screen and padded case for it.,"['wife', 'techie', 'word']"
649,My wife wanted an iPad. I bought her this because it was cheaper and good for reading and playing games. She uses iOS products so it's not compatible. She hardly ever uses it. Next time I'll get what she wants and not waste my money.,"['wife', 'reading', 'playing']"
650,Much better screen resolution than my 7 inch fire.,"['screen', 'resolution', 'inch']"
651,"I bought this tablet for my Mom and she loves it. I used it myself and it's very easy to use and works nicely with Amazon Prime, etc. definitely would recommend especially for the price.","['tablet', 'use', 'work']"
652,I enjoy using the tablet. I use it when I am biking.,"['use', 'tablet', 'bike']"
653,This really a nice tablet.It runs great and it's thin and easy to hold.,"['tablet', 'hold']"
654,This tablet is quick and as good as my iPad! I use the tablet specifically for one aspect of my life and it performs great! I am pleasantly surprised by its performance!,"['tablet', 'aspect', 'life']"
655,I have a 4 year old boy and 6 year old girl and 12 year old boy no cracks or broken yet yes they have dropped them no case but no cracks yet pretty amazing when they drop it on hard wood floors and still not broke!!,"['boy', 'year', 'drop']"
656,Wow I've had quite a few different kindles over the years and I've loved all of them. But this kindle fire hd 8 is by far my favorite. So glad my husband bought it for me the best purchase ever.,"['kindle', 'year', 'fire']"
657,"Upgraded from a standard Fire tablet. Better screen, a bit faster than standard Fire.","['tablet', 'screen', 'bit']"
658,In my opinion this the absolute best value on a tablet out there. No way to go wrong at this price,"['opinion', 'value', 'tablet']"
659,the new sound and the faster speed plus other improvments are great,"['sound', 'speed', 'improvment']"
660,"I am very happy with this Amazon tablet. I purchased it for business purposes, as well as recreational, and it works great for both. I did get an SD card for more memory. Also, if I would have bought directly from Amazon, there would've been a 1 month wait. However, I was able to order from Best Buy online, and pick it up that very day!!!","['business', 'purpose', 'sd']"
661,Its perfect to see my tv series when i don't have my tv around. It has a very good resolution quality.,"['tv', 'series', 'resolution']"
662,"I bought the 8"" to replace my old 7"". I love the bigger screen",['screen']
663,Freeze frequently... No way to trouble shoot or repair it...,"['way', 'trouble']"
664,I got myself 1 of these tablets and so far I love the way it works You can enlarge the print and change the lighting to make it easier to read. The only thing with it is you must have an Amazon account to use it.,"['way', 'work', 'print']"
