,reviews.text,Aspects
665,This kindle rocks! Tons of storage at an awesome price.,"['rock', 'ton', 'storage']"
666,bought it as a gift for my mother and she loves it,"['gift', 'mother', 'love']"
667,I love the fire....it works great and the navigation through the Fire is user friendly too. I think the 8 is the better buy for your money.,"['fire', 'navigation', 'user']"
668,"BY FAR THE BEST TABLET IVE EVER OWNED, EASY AND QUICK SET UP","['EASY', 'QUICK']"
669,This tablet is very good especially considering the price. also has memory slot to increase storage.,"['tablet', 'good', 'price']"
670,I bought this tablet over the holidays when it was on sale. It has been a great tablet. The battery life is great on these new models. Also playing games everything moves smoothly since it has more ram. The durability of the tablet is great. This thing won't break if you drop it. The only thing I don't like is the fire os. You can't get everything you can get on the google store so not all apps are available.,"['thing', 'holiday', 'sale']"
671,I have had a few kindle's in the past so this was nothing new for me but what I loved about this one is that the screen is big so when I am reading a book it's a lot easier than when I had the first kindle screen. I mostly use it just for the reading but being able to navigate the internet on it is great for when I want to look something up about the book real quick or if you want to search reviews on a book before purchasing. I love it!,"['book', 'screen', 'lot']"
672,Purchase this tablet during the Christmas sale. This tablet is a good tablet for a beginner. Easy to use and shows movies and videos very well.,"['tablet', 'purchase', 'sale']"
673,Great tablet for on the go. Good size screen to watch movies or read book.,"['tablet', 'size', 'screen']"
674,"Light, portable and great features. Highly recommended.",['feature']
675,"For the price and features offered on the tablet, I wouldn't purchase any other tablet. I enjoy using it and overall find it fairly easy to navigate. Easy internet browser with ""Silk"" and convenient access to all the applications I am interested in.","['tablet', 'price', 'feature']"
676,Bought it for a friend he likes it.would recommend it.,['friend']
677,This tablet was everything I was looking for: a cheap tablet that could download Netflix shows for offline viewing,"['tablet', 'view']"
678,"Unlike my first Kindle, this tablet gives me all kinds of information, advertisements and offers when I first turn it on. I could live without that, but overall, I am pleased with this new tablet. It does many things I haven't taken the time to explore, but hope to soon.","['tablet', 'information', 'advertisement']"
679,"This is a great tablet for the price. Would give it 5 stars if it had included some sort of instruction manual. Otherwise, definitely recommend.","['tablet', 'price', 'star']"
680,This is a great tablet with great features. I love my kindle.,"['tablet', 'feature', 'kindle']"
681,Can't beat the price on this tablet! Great for streaming or casual games.,"['price', 'tablet', 'game']"
682,Great for reading and Netflix. Fits nice in purse. Good price.,"['purse', 'price']"
683,Good value at a very affordable price. Can't beat it.,"['value', 'price']"
684,Works great prety fast operating system dosent heat up,"['prety', 'operating', 'system']"
685,We love this so much in our home. We bought a super tough case and let our two and six year old use it. They love watching their movies on it and playing different apps. It is a really good value!,"['case', 'year', 'watch']"
686,"Great tablet! Brought this for my wife and she loves reading off of it! Great price, easy to use! Great purchase!","['tablet', 'wife', 'love']"
687,"Very fast, very functional. Love the e-reader function. Movies, music and internet work great. LOVE IT!","['love', 'reader', 'function']"
688,"I received this as a gift from my husband. It's great for reading, gaming and watching Netflix.","['gift', 'husband', 'reading']"
689,"I exchanged a highly unsatisfactory Insignia unit for the Fire. I was looking for a 10 inch screen, but went to the smaller size for performance. I have no complaints with the Amazon product, other than the ubiquitous advertising.","['unit', 'inch', 'screen']"
690,My daughter loves her tablet. I had to make sure I brought a case because it is very thin. No problems and I can see everything she downloads,"['daughter', 'love', 'case']"
691,"Have a fire 7 and wanted a bigger screen, love the new one.","['fire', 'screen']"
692,Perfect for our needs and an on the go mini computer and ereader.,"['need', 'computer', 'ereader']"
693,"This tablet is great for books, audible books, music and all things Amazon. The included browser (Silk) is not the best. I purchased expanded memory (64GB SD card) for about $30 more and a cover for about $20. The biggest issue I have with this unit is that it is slow (when compared to an iPad) and it tends to freeze every so often. For about 2.5x more money, consider an iPad instead.","['book', 'tablet', 'music']"
694,Great tablet use it for reading and email. Great price!,"['tablet', 'use', 'email']"
695,Nice little tablet. Functional and easy to use.Fits the needs that I need to use it for.,"['use', 'tablet', 'need']"
696,Awesome.and repeat 50 times. That should do it. Blah.,['time']
697,"I initially bought the tablet for school, I use Kindle to rent books but after using it to stream Xfinity, Netflix, and Amazon Prime I loved the sound and picture quality. I would recommend this to anyone needing a good low cost tablet with great battery life.","['tablet', 'school', 'rent']"
698,We have had no issues with this tablet. Love it!TY,['tablet']
699,For the price it's a bargain. This is a perfect solution for a reader and simple browsing. I use this at night before bed.,"['price', 'bargain', 'solution']"
700,My first tablet experience and it's awesome. I love being able to stream movies and have numerous apps at my fingertips.,"['tablet', 'experience', 'stream']"
701,Bought this for my wife and she loves it! This was our third kindle over a period of many years'Can't go wrong for the price.,"['wife', 'kindle', 'period']"
702,Love this tablet. Power lasts long. Short charge time. HD screen is really clear. Only con is that there are some apps not available like Google play. Very satified. Have a 128gb card in mine . Plenty of space for downloads. The camera has no flash and is not the best but I didnt buy this tablet for that. High recommend the HD tablet 8gb amazon fire. You want go wrong.,"['power', 'charge', 'time']"
703,This tablet does all the things I really need. I have it some thought before buying I don use most of the features a more expensive computer/tablet has. Have been very happy with my purchase.,"['tablet', 'thing', 'feature']"
704,Got this for my wife's birthday. She had an older model and wanted an upgrade. She seems very happy with it and uses it every day,"['wife', 'birthday', 'model']"
705,Very user friendly...long lasting battery....very clear display,"['user', 'battery', 'display']"
706,"Worse graphics, won't keep a wireless connection,overall not satisfied","['graphic', 'connection']"
707,Easy to transfer my stuff from my old Kindle into this new one. Love the price and how easy it is to use. Great buy.,"['transfer', 'stuff', 'love']"
708,"This is my first kindle. It works great for my use. Mostly reading, email, and Amazon shopping.","['kindle', 'use', 'email']"
709,"Amazon Fire HD8 is one of the best deal at 89$. Strong, efficient, low price and some Amazon features that I love. Youtube videos of how to get googleplay and android apps have made things lot more easier. And now, microsoft office is available online for free that I can access and edit my documents. What else do I need? Amazon is more respectable brand name than other low price brands or used/old models of high price brands. Definitely recommend it.","['price', 'brand', 'deal']"
710,I held off getting a tablet and wish I had done it sooner. The Amazon Fire 8 is great and easy to use,"['tablet', 'wish', 'use']"
711,"i have been looking at tablets for a long time, most of them a little expensive for what i would use it for. This tablet lets me read, email, searches and the best part I can buy books through amazon and not have to carry heavy books with me when i travel","['book', 'time', 'tablet']"
712,"Not the highest quality of tablet out there, but for the price you almost can't beat it, especially if you are an Amazon Prime member.","['quality', 'tablet', 'price']"
713,I liked the screen size and easy to read books at night. The battery has a long life. The outer rcase could be stronger because concerned about durability.,"['screen', 'size', 'read']"
714,Works great for everything we want our daughter to do,['daughter']
715,"it's wonderful. I love it. It's easy to watch movies, play games and read books.","['watch', 'movie', 'game']"
716,love it just like my other one just better!!! since I already own a kindle I knew this was what I wanted. Just needed a second one and a little bigger. Always loved the service and help I get at BB so I knew I would purchase it there!! Found salesman to be knowledgeable and most helpful. Thanks so much for your help and service,"['service', 'help', 'love']"
717,New Kindle replaced my old Kindle that had a lot of books. To my surprise the book transfer worked well. Seems to work surfing the net. Music sound is only okay.,"['book', 'work', 'lot']"
718,Great little device that does almost everything a Tablet does. I use it as my computer when I travel as well as a reader.,"['device', 'computer', 'reader']"
719,Has meet all my needs plus some. Recommend you buy a good stylus pen at the same time.,"['need', 'pen', 'time']"
720,It fits just right in your hand. Light weight. Love it,"['hand', 'weight', 'love']"
721,I extremely happy with my purchase. I like that the screen is just a little bigger and much faster.,['purchase']
722,"Good picture, works well, great variety of apps. keep in mind that you get apps from amazon, not google play, so they aren't always the same or same price","['picture', 'variety', 'mind']"
723,"This replaced my old Kindle Fire. I have not yet explored all of the features but, so far, it is performing very well. Tablet is a good size and weight, and easy to use.","['replace', 'feature', 'size']"
724,This tablet has been the best one for the price we have purchased 3 other tabs for our kids and they have all broke and ran super slow they love them would definitely recommend this to anyone who wants to save a buck but want quality,"['tablet', 'price', 'purchase']"
725,I would recommend this product it is a good tablet to use have had no problems.,"['product', 'tablet', 'use']"
726,"Kids love it, under $100 so the price is great. Don't have to worry about it getting mishandled as much. Still can't get them off the ipad though.","['love', 'price', 'ipad']"
727,"I went with this tablet based on many good customer reviews, but my experience was not a good one. From the start I was on the phone every day for at least an hour with Amazon tech support for one issue or another. Most of the techs were very polite, but not all knew the product very well. At one point I asked one of them about trying to save some RAM and they kept referring me to the storage, which told me they didn't even know the difference between RAM and regular storage. The internet browser was basic and it ran very slow at times, even when all my other wifi devices ran great. Then a day would pass and I'd be trying to type an email and the keyboard would just stop working...wtf??? Come to find out it's a ""known issue"" and ""they're working on it"". After two weeks of one thing after another I got fed up and just returned it. I wanted it to work, and gave it a good run, but just not quality stuff. To me it was like Walmart trying to build their own computer when they're obviously not a computer manufacturer, neither is Amazon. If I were you I'd look at a regular Android tablet from a reputable PC manufacturer, which is exactly what I did next. I got an ASUS tablet for only a few dollars more, and it's unbelievable. 1000% better in comparison to the Amazon Fire HD8. Save yourself the aggravation and go with ASUS or some other company that is specifically in the computer business full time. Sorry Amazon, not this time!","['tablet', 'time', 'computer']"
728,"Not very fancy, but not slow. If you have Amazon Prime, you have a access to a great library of TV shows and Movies for free. Same goes for free book rentals. The Amazon App store is not so great, lots of apps are outdated but still work. Just not the latest versions you would expect. But the Amazon Underground appstore does offer free access to games you would normally pay for. It's decent for it's price and a good deal if you don't want anything fancy.","['library', 'tv', 'show']"
729,I love my Kindle fire. Had a Kindle and it disappeared. Enjoy not having to go to library for books. I get a great selection of books every day.,"['book', 'fire', 'selection']"
730,Light weight and easy to use. Very user-friendly. Durable.,"['weight', 'use', 'user']"
731,For the price the tablet can not be beat. I use this over my ipads that i have. There is nothing i cant do with this tablet,"['price', 'tablet', 'beat']"
732,I recently upgraded to this tablet; it is everything I wanted. Highly recommend!,['tablet']
733,It was a good buy and tried this for a day. It was fast and experience was good.,"['day', 'experience']"
734,"I purchased this tablet knowing exactly what my needs were and how well the Kindle could meet them. Despite the ""walled garden"" philosophy that tethers you mostly to Amazon products and services, the ability (as of right now) to side-load the Google Play Store makes this a surprisingly versatile device for the price point.","['tablet', 'garden', 'philosophy']"
735,This is a great tablet for the price! I bought it to replace my iPad mini. Great for ereading and general browsing.,"['tablet', 'price', 'mini']"
736,"This replaced a Kindle 7 HDX with 32GB of ram. The older tablet had a charging port that wasn't functioning anymore. Had the Geek Squad warranty so they issued a full credit for the old tablet and my son chose the HD8 as his new tablet. Other than the screen resolution being lower and less memory, great tablet. My son didn't care about the resolution and the new Kindles let you pop in an SD card for more storage. Popped in a 64GB SD card and he's a happy camper now.. ;)","['tablet', 'son', 'card']"
737,"I purchased this as a gift but have had extensive time with it. It's a great budget tablet, phenomenal screen and a very smooth interface. Handles all apps and HD content well.","['gift', 'time', 'budget']"
738,This was a birthday gift to my husband. He really likes it and it does what he needs it to do,"['birthday', 'gift', 'husband']"
739,"I ""retired"" an earlier version and this new souped up model more than meets my needs, and the battery lasts so much longer!!","['version', 'soup', 'model']"
740,I have a kindle and wanted more options. I love the bigger screen. I find it easy to read. It can have some reflection under lights but not much.,"['option', 'screen', 'read']"
741,"This tablet is easy to set up, has great resolution, and is perfect for reading books or surfing. The price is affordable, too. It is perfect for anyone who wants a fun and casual way to use technology.","['tablet', 'resolution', 'reading']"
742,"This was bought to replace my old Kindle with keypad, and experimental internet. Was surprised how much the Kindle had changed, and at the same price as my old one was when I bought it!Have already shown it to a couple of friends who now say they are thinking about getting one.","['buy', 'replace', 'keypad']"
743,Really enjoying my new tablet. I like to travel and me and my family use it to play game and watch movies. Just the right size to.,"['tablet', 'travel', 'family']"
744,Liked this Kindle upgrade. The color screen and backlights allowed for easy night use,"['color', 'screen', 'backlight']"
745,"I enjoy the new kindle, only things I would like to change is the way screen darkens and lightens while reading. Not sure how to stop that. Occurs consistently. Also, would like to stop the ads seen each and every time kindle is turned on to start reading again. That is bothersome. Otherwise, am happy with the kindle.","['kindle', 'thing', 'way']"
746,I purchased the 8 inch device. Also purchased black cover.I played for it and asked if I could get it set up and was told it would be 40 more dollars. I did not have 40 more dollars so I left the store with my kindle and had someone else set it up for free. I was disappointed I had to get someone else to set up my kindle.,"['kindle', 'inch', 'device']"
747,My previous Kindle was dying and I wanted a new replacement fast. I went to Amazon and while they had one it was back ordered a month. Expecting to pay more I went to Best Buy and not only found it for the same price but even better it was available at my local store and I could pick it up the same day!,"['die', 'replacement', 'order']"
748,I got this for my son to play games on soI could get my iPad back. Personally I think it's a great little tablet for kids and or for reading. Other then that it's not a high powered game playing tablet or anything to keep lots of storage on. But it works for what it's intended for andI have no problems.,"['game', 'tablet', 'son']"
749,Easy to use You cant beat it for the price you pay,"['use', 'price', 'pay']"
750,This Kindle is larger than my old one and book reading is much easier. Some features I don't use so can't comment on them. All in all I love it.The only drawback was that the store had no covers that fit this Kindle.,"['book', 'feature', 'store']"
751,"We purchased this as a replacement for our now-broken iPad. Though we liked the smaller size (more convenient, easier to carry, etc), the internet was sooooooo slowwwwww that it drove us crazy. Sometimes minutes to download a site (and this with no other apps open!1). Plan to go back to another iPad.","['replacement', 'size', 'carry']"
752,Tablet is great and easy to use thankfully because its my 1st tablet,['use']
753,This is an item that is easy to use for novices. My child uses it and has no issues,"['item', 'use', 'novice']"
754,Easy to use. Pretty user friendly. It is good value for the price,"['use', 'user', 'value']"
755,"No problems with tablet, kids love it and the size is great","['problem', 'tablet', 'love']"
756,"My nephews love to play with my phone. Now as anyone who has been around small humans knows they have an astounding ability to perpetually have something sticky on their hands. However, if its a rare case where they don't they will probably drop the device from the lack of said stickum. The kindel has come to my rescue as it has everything they need to be entertained. And best of all it lacks the anxiety inducing price tag for that moment when the kids demonstrate Murphy's law in action.","['lack', 'nephew', 'kindel']"
757,Was a present for my 14 year old grandson. He was very pleased.,"['year', 'grandson']"
758,"The Kindle fits me to a ""T"". Very quick to start. It shows how to get things done.","['t', 'start', 'thing']"
759,"For under $100 this 8"" tablet is a bargain. I do all I want on it like; check email, Facebook, Twitter, watch YouTube, read books, and shop on eBay or Amazon. I've been very pleased with my purchase.","['bargain', 'email']"
760,Bought this for my wife for our anniversary she loves it,"['wife', 'anniversary', 'love']"
761,I love to read and this tablet work great for my needs.,"['tablet', 'work', 'need']"
762,"I know beforehand that this is not a powerful tablet. But it's the best bargain at this price point . The screen is okay if you just read books, news, or surf the websites. But if you want to enjoy videos-this is not your choice.The processor is slow and the amazon app store doesn't have all the apps like you'd expect from Google appstore- even though the OS based on android. But few tweaks let you install the Google playstore-search online for the steps.Overall I'm satisfied with my purchase. Hope this is helpful.","['tablet', 'bargain', 'step']"
763,"I bought it for my grand daughter, she knew how to use it right away. You can purchase a rubber case in different colors for protection.","['daughter', 'use', 'rubber']"
764,It is just an average tablet. Bit slow but is a good option for people on budget,"['tablet', 'bit', 'option']"
765,Very nice for reading and watching videos. Strong wi fi is a must. Slippery to hold so buy a cover,"['reading', 'watch', 'video']"
766,Tablet stopped working after owning for two weeks. Came back on after an hour.,"['work', 'week', 'hour']"
767,"This device is great for the price! I use it for my daughter and after having seeing the ads on amazon, I thought this would perfect for her.","['device', 'price', 'daughter']"
768,"I think that the Amazon Kindle tablet was a great purchase for my teenage daughter and grandson, very easy to operate. It kept them entertained for hours while we were traveling on the train for vacation.","['purchase', 'teenage', 'daughter']"
769,Great device. Works very well and use it throughout the day.Keeps me informed and great for looking up things and staying in contact.,"['device', 'day', 'inform']"
770,"I love my kindle, I can listen to music,read my emails, or pick a book to read. Everything loads up easily.","['kindle', 'music', 'email']"
771,"I really enjoy my new kindle, still getting used to it.",['kindle']
772,I have done this like 5 times now. Don't send me this ahs8n. Getting aggravating.,"['time', 'ahsn']"
773,"This is an affordable tablet and works well, you just have to deal with a lot of advertising.","['tablet', 'work', 'deal']"
774,"Love how I am able to run the latest Minecraft on this device, but am not able to on a 3-year-old iPad. It seems as apple handy cap their devices. Resolution may not be the best, but for the little buggers it works fine","['device', 'love', 'minecraft']"
775,"I love my Fire HD8 I got it because my Kindle(the original) that my husband bought me died and the Verizon Tablet wasn't working great for me. So I came down and the agent at store showed me this one, there is a learning curve but it gets better and takes a while to learn but I love it.","['husband', 'work', 'agent']"
776,"Does all the basic stuff I need at a great price. I use it for some apps, web browsing and some video. Picked this over the Fire 7"" for the screen size, resolution and CPU/GPU. Battery life is pretty good. Ads aren't too annoying.Far cheaper than competing name-brand budget tablets while doing almost everything needed at this level and probably better supported. FireOS will always be a little behind the current Android version and I'd rather have Google Play than Amazon, but this still allows for side-loading stuff.Recommend if you're ok with living in Amazon's world and/or proficient enough to load other app stores or packages (or know somebody can).","['stuff', 'app', 'brand']"
777,"this item work just as I expected it to, great product!","['item', 'work', 'product']"
778,"This is the third Fire we've purchased, and Amazon finally made this level memory-upgradable. That has made all the difference. I bought Fire tablets for use as a 'kid tablets', for which they work great...until you run out of memory. 8GB is practically nothing these days (I remember when having 64kb was a HUGE upgrade to my Atari!) so being able to toss in a memory card give my kids much more utility.","['memory', 'tablet', 'fire']"
779,"Have a nook , this is much better has more apps and thru amazon","['app', 'amazon']"
780,I love the size and the HD quality. Just what I was looking for!Downloads apps really fast!,"['size', 'quality', 'app']"
781,Never thought a tablet at this price could be this good. Totally recommended!,"['tablet', 'price']"
782,This is my sixth unit and has features many of the newer models didn't have.,"['unit', 'model']"
783,Thank..............................................,[]
784,"I had the original kindle fire for ten years and I loved it. But it broke on me and I decided on this one after looking at all the upgrades from the original. It let's you do so much more, but some of the tutorials (like for the internet) weren't helpful.","['kindle', 'fire', 'year']"
785,"Lightweight, nice display and not too large to carry.","['display', 'carry']"
786,this is the perfect size for an older person who uses it minimally.,"['size', 'person']"
787,"Good tablet, satisfied. One point annoying...silk browser makes Yahoo email a list and have to tap HTML to read each one...Awkward.","['tablet', 'point', 'email']"
788,I love the apps that are on here and everything else I think it's the perfect tablet for a beginner has all of the apps that you will need,"['app', 'beginner']"
789,Love this tablet. 16GB memory but have expansion slot. Bought 128GB micro SD card for $56. Love this feature,"['tablet', 'memory', 'expansion']"
790,I love Amazon Fire HD8... It is so easy to use and perfect for reading books on or cruising Social Media. I love that it has Alexa included on it.,"['reading', 'book', 'cruise']"
791,"I love my Kindle for reading manga and comics. The fact that the graphics are worse than my phone detracts a little from the expirence, but serves to remind me that I cheaped out and bought yesterday's model. This is not a real negative, it just appeares less crisp than my phone. The increased picture size more than makes up for it in my book.","['phone', 'fact', 'detract']"
792,This thing lasted not even a month before it went dead. Going to try and take it back,"['thing', 'month']"
